{
  "alg": "ed25519",
  "version": 1,
  "sha256": "0a1531f03ebee215f145447b74a25f61ab1d413ddabd8b228bd762523848cafc",
  "fingerprint": "6eb7d8fc0dd55ab4e3345ace326fcffa81afbfac5a69f2b21e920666e3bc2899",
  "signature": "j9QcIWhzE2drRsbW+t7Efu+RnPKssyS9/SqfhlVswsxSkC1PY4T4x9dlTyHLUjGTzuEZfNBc9V+l1qnJHevWAw==",
  "publicKey": "-----BEGIN PUBLIC KEY-----\nMCowBQYDK2VwAyEAhYZfZtKH8eRvgPvAJpYIslpk11xq4W+4jeotWoJOHuQ=\n-----END PUBLIC KEY-----\n"
}
